Запрос,Ранг,Название документа,Описание,Релевантность (1-3),Релевантность (0/1)
бизнес-ангелы,9,Фонд Дмитрия Гришина и другие инвестировали $1 млн в игровой стартап Playbite | RB.RU,"Фонд Дмитрия Гришина Grishin Robotics, Capitalize VC, M25 и другие инвестировали $1 млн в платформу для мобильных мини-игр Playbite. Стороны закрыли seed-раунд 31 октября 2023 года. Это следует из данных Crunchbase, на которые обратил внимание корреспондент RB.RU.",1,0
бизнес-ангелы,10,"Бизнес-ангелы: кто это, их функции и как их найти","Кто такие бизнес-ангелы? Чем они занимаются, как привлечь инвестиции бизнес-ангела и где их искать? Оформляем отношения и разбираем плюсы и минусы.",3,1
бизнес-ангелы,11,Фонд «Сколково» решил обанкротить стартап «М-Пауэр Ворлд» с грантом в 420 млн рублей | RB.RU,"Фонд «Сколково» подал иск в Арбитражный суд Москвы о банкротстве одного из своих первых стартапов ООО «М-Пауэр Ворлд» из-за долга в 22 млн рублей, узнал RB.RU. Первое заседание по делу назначено на 29 августа. Компания успела получить от Фонда 267 млн рублей из гранта почти на полмиллиарда рублей.",1,0
бизнес-ангелы,12,«Тинькофф» может открыть свой пенсионный фонд | RB.RU,"«Тинькофф» может открыть пенсионный сберегательный фонд. Банк уже зарегистрировал четыре домена с упоминанием сочетания «НПФ» — tinkoff-npf.ru, npf-tinkoff.ru, tinkoffnpf.ru и npftinkoff.ru, пишут «Ведомости».",1,0
бизнес-ангелы,13,Что такое негосударственный пенсионный фонд (НПФ) и для чего он нужен,"Что такое негосударственный пенсионный фонд, как его выбрать и в чем их преимущество? В чем разница ПФР и НПФ, как выбрать НПФ и как сменить?",1,0
бизнес-ангелы,14,Запущен инвестиционный фонд для IT-компаний малого и среднего бизнеса | RB.RU,"Компания «Тим Форс», работающая в сегменте смартстаффинга (технология, которая позволяет организациям предоставлять и привлекать временно доступный персонал), вместе с партнерами создала фонд «Тим Форс Альянс» для IT-компаний малого и среднего бизнеса. Об этом RB.RU сообщил представитель «Тим Форс».",1,0
бизнес-ангелы,15,Инвестор Балтер получила 11% в EdTech-стартапе Care my baby | RB.RU,"Инвестор Екатерина Балтер получила 11% в ООО «Забота», российском юрлице EdTech-стартапа Care my baby, свидетельствуют данные ЕГРЮЛ. Эксперт оценил онлайн-сервис дополнительного образования для детей в 100 млн рублей.",1,0
бизнес-ангелы,16,"Пенсионный фонд «Тинькофф», Almaz Capital снова вложился в стартап выходца из России Zededa: главное 9 февраля | RB.RU","«Тинькофф» может открыть пенсионный сберегательный фонд, Almaz Capital Александра Галицкого снова вложился в стартап выходца из России Zededa, финтех-компания Pennylane в ходе раунда С привлекла €40 млн от DST Global и Sequoia Capital и другие события 9 февраля.",1,0
бизнес-ангелы,17,"Из стартапа FitStars, в который инвестировала модель Елена Перминова, вышел бизнес-ангел | RB.RU","Бизнес-ангел Всеволод Баев вышел из состава совладельцев сервиса домашних фитнес-тренировок FitStars (юрлицо ООО «Парсек»). Инвестор передал долю в 2,12% основателю сервиса. За четыре года доля могла подорожать в 1,7 раза, считают эксперты.",3,1
бизнес-ангелы,18,Фонд «ТилТех Капитал» консолидировал ритейлера Noun | RB.RU,Венчурный фонд Андрея Кривенко «ТилТех Капитал» приобрел 100% сети магазинов женской одежды Noun у основателя Семена Пименова.,1,0
бизнес-ангелы,19,Хроника венчурной сделки: на что обращает внимание инвестор? | RB.RU,"Анатолий Горелов, директор «СПИн», поделился историей одной венчурной сделки. В ней он раскрыл свой взгляд на процесс — и рассказал, что именно было важно в стартапе для него как инвестора.",2,1
бизнес-ангелы,20,Бизнес-ангелы с российскими корнями инвестировали в стартап Essence | RB.RU,"Французский стартап, разработчик приложения для мониторинга женского здоровья, Essence привлек финансирование в размере $ 600 тыс. на развитие бизнеса от Berkeley SkyDeck, Davidovs VC, Growing Well Partners и нескольких бизнес-ангелов, в том числе с российскими корнями.",3,1
богатейшие предприниматели России,1,Самый богатый бизнесмен Европы подал в суд на X Илона Маска | RB.RU,"Несколько ведущих СМИ Франции, включая две газеты, принадлежащие богатейшему бизнесмену Европы Бернару Арно, подали в суд на соцсеть X Илона Маска. Об этом сообщает The Telegraph.",1,0
богатейшие предприниматели России,2,Рейтинг Forbes: Татьяна Ким  — самая богатая женщина России | RB.RU,"В 2025 году в рейтинге Forbes Woman оказалось рекордное число женщин-миллиардеров — сразу девять. На первых десяти строчках списка совокупное состояние участниц превышает $19 млрд. И главное — изменилась сама модель капитала: теперь это не только наследство и офшоры, но и создание брендов с нуля, и инвестиции.",3,1
богатейшие предприниматели России,3,Бакальчук в третий раз возглавила рейтинг 20 богатейших женщин России | RB.RU,Основатель и генеральный директор Wildberries Татьяна Бакальчук уже три года подряд возглавляет рейтинг 20 богатейших женщин России по версии Forbes.,3,1
богатейшие предприниматели России,4,"Состояние богатейших бизнесменов России выросло в 2025 году на $22,6 млрд | RB.RU","Состояние богатейших бизнесменов России с начала 2025 года выросло на $22,6 млрд, свидетельствуют данные Bloomberg Billionaires Index («Индекс миллиардеров»). Лидерами по преумножению капитала стали президент «Норникеля» Владимир Потанин и акционер «Металлоинвеста» Алишер Усманов.",3,1
богатейшие предприниматели России,5,Еще два предпринимателя отказались от гражданства России | RB.RU,"Основатели американских IT-компаний Veeam Software и Object First Андрей Баронов и Ратмир Тимашев отказались от гражданства России. Они стали восьмым и девятым бизнесменами, сдавшими свои российские паспорта с начала 2022 года, пишет Forbes.",2,1
богатейшие предприниматели России,6,Одна из богатейших женщин России Ольга Белявцева осталась партнером Лисина во «ФрутоНяне» — РБК | RB.RU,"Одна из богатейших женщин России Ольга Белявцева сохранила миноритарную долю в производителе детского питания под брендом «ФрутоНяня» — АО «Прогресс» — после приобретения мажоритарной доли структурами, близкими к основному владельцу НЛМК Владимиру Лисину. Об этом пишет РБК со ссылкой на двух источников.",3,1
богатейшие предприниматели России,7,Признаки богатства: как распознать богатого человека,"Узнайте, что такое богатство, 11 основных признаков богатого человека — читайте в статье на RB.ru.",1,0
богатейшие предприниматели России,8,ИП в России: количество предпринимателей выросло на 23% | RB.RU,"Количество индивидуальных предпринимателей в России выросло на 23% в январе–сентябре 2025 года по сравнению с тем же периодом 2024-го, сообщают аналитики сервиса Solar Staff. Среднемесячный доход ИП увеличился на 30,7%. Рост связывают с налоговой реформой 2025 года, введением прогрессивной шкалы НДФЛ и общей тенденцией к легализации доходов.",1,0
богатейшие предприниматели России,9,Маск и Джобс вдохновляют 25% предпринимателей в России | RB.RU,"Исследование ЮKassa показало, что российские предприниматели уверенно ищут точки роста даже в условиях турбулентности. Они опираются не столько на Москву и Петербург, сколько на новые технологии, успешные кейсы знаковых фигур и собственную мотивацию. Пессимизм на рынке есть, но он не мешает бизнесу масштабироваться.",1,0
богатейшие предприниматели России,10,"4 совета для предпринимателя, развивающего сеть в России | RB.RU","В разных регионах люди потребляют по-разному. Мы чаще говорим о страновых отличиях в потреблении, но даже в рамках одной страны и одного региона России привычки и модели потребления могут очень различаться.
О том, как узнать об этих особенностях и использовать их, выводя бизнес за пределы своего города, рассказывает предприниматель из Владивостока, генеральный директор сети автокафе Coffee Machine Дмитрий Лутченко.",1,0
богатейшие предприниматели России,11,Почему в России сложно стать серийным предпринимателем | RB.RU,"Запустить и вести одновременно несколько бизнесов — задача со звездочкой. Что мешает стать серийным предпринимателем в России, объяснила основатель и генеральный директор платформы Sellty, заместитель генерального директора и партнер ГК «Корус Консалтинг» Мария Бар-Бирюкова.",1,0
богатейшие предприниматели России,12,Илон Маск больше не самый богатый человек в мире  | RB.RU,"Ларри Эллисон впервые возглавил список богатейших людей планеты по версии Bloomberg Billionaires Index, сместив Илона Маска с первой строчки. Состояние сооснователя Oracle выросло за сутки на $101 млрд — это крупнейший однодневный прирост капитала за всю историю индекса. Общая сумма его богатства теперь оценивается в $393 млрд.",1,0
богатейшие предприниматели России,13,Открыть ИП в России: доля молодых предпринимателей — 23% | RB.RU,"Молодёжь всё активнее идёт в бизнес, не откладывая старт на потом. По данным СберАналитики, исследовательского центра экосистемы Сбера, сегодня почти четверть индивидуальных предпринимателей в России — молодые люди до 35 лет. В общей структуре их доля составляет 23%.",1,0
богатейшие предприниматели России,14,"Число молодых предпринимателей в России достигло 2,7 млн | RB.RU","Число молодых бизнесменов в России достигло 2,7 млн человек — это 6% от общего количества предпринимателей в стране и рекорд с 2019 года, сообщили Русбейс в пресс-службе Минэкономразвития.",1,0
богатейшие предприниматели России,15,"Исследование: большинство предпринимателей в России не знают, куда движется их бизнес | RB.RU","По результатам опроса выяснилось, что у 51% предпринимателей нет четких целей на год, квартал или месяц. 47% опрошенных заявили о том, что умеют достигать результата.",1,0
богатейшие предприниматели России,16,В России стало на 5% больше юрлиц и предпринимателей в гостиничном бизнесе | RB.RU,"Количество зарегистрированных в России юридических лиц и предпринимателей, которые оказывают гостиничные услуги, выросло за год на 5,02%. В январе 2025 года сфера насчитывала 39,5 тыс. компаний и предпринимателей, приводит «Коммерсантъ» данные «Контур.Фокуса».",1,0
богатейшие предприниматели России,17,Как предпринимателям из России попасть в Y Combinator в текущей обстановке | RB.RU,"Y Combinator — один из самых престижных акселераторов в мире, из которого вышли такие культовые бренды, как Airbnb, Reddit, Stripe и Dropbox. В него мечтают попасть многие предприниматели, однако в последние годы стартапам из России стало непросто пройти отбор.
Генеральный директор Mighty Buildings — компании из топа рейтинга Y Combinator Companies — Вячеслав Солоницын рассказывает, как русскоязычным компаниям попасть в программу в нынешней обстановке.",1,0
богатейшие предприниматели России,18,Состояние богатейших россиян достигло $305 млрд | RB.RU,"Состояние 20 богатейших российских бизнесменов с начала 2025 года выросло почти на $20 млрд и достигло $305,3 млрд, подсчитал Bloomberg. Наибольший рост показал основатель Telegram Павел Дуров, прибавивший $4,82 млрд и доведший капитал до $15,8 млрд. При этом не все оказались в плюсе: председатель совета директоров НЛМК Владимир Лисин потерял $3,17 млрд, опустившись до $22,7 млрд.",3,1
богатейшие предприниматели России,19,Топ-15 привычек самых успешных и богатых людей,"Узнайте о ключевых привычках, которые помогают успешным и богатым людям достигать своих целей. Список полезных привычек, чтобы улучшить вашу жизнь и карьеру — читайте в статье на RB.RU.",1,0
богатейшие предприниматели России,20,"Число молодых предпринимателей в России достигло 243,5 тыс. — Минэкономразвития | RB.RU","Число молодых предпринимателей в России достигло 243,5 тыс., сообщили в Минэкономразвития. С 2019 года количество предпринимателей в возрасте до 25 лет выросло с 1,5 раза. Доля таких ИП в общей численности пока невелика, но темпы прироста увеличиваются.",1,0
венчурные фонды России,1,Инвестиции в России в 2025-м: венчур вырос на 86% | RB.RU,"Рынок в России в первом полугодии 2025 года показал резкий рост в деньгах, но падение в активности. Общий объём инвестиций увеличился на 86%, тогда как количество сделок сократилось на 27%. Внимание инвесторов смещается на более зрелые, стратегически важные проекты.",3,1
венчурные фонды России,2,Фонд «Восход» на платформе «Атомайз» впервые в России запустил венчурные ЦФА | RB.RU,Венчурный фонд «Восход» на платформе «Атомайз» открыл книгу заявок для выпуска первых в России венчурных цифровых финансовых активов (ЦФА). Планируется выпустить токены на 260 млн рублей. Заявки принимаются до 8 июля.,3,1
венчурные фонды России,3,Венчурный фонд Malina VC инвестировал 20 млн рублей в развитие сети кофеен «Даблби» | RB.RU,"Венчурный фонд Malina VC купил акции сети кофеен «Даблби» на 20 млн рублей, рассказал RB.RU сооснователь фонда Антон Пронин. Средства направят на расширение сети кофеен по модели пассивной франшизы.",3,1
венчурные фонды России,4,Венчурный фонд Malina VC выкупил долю девелопера «Самолет» в сервисе доставки «Даркстор у дома» | RB.RU,"Сервис квартирных решений «Самолет Плюс» (мажоритарный акционер — группа «Самолет») продал всю долю в сервисе доставки «Даркстор у дома» венчурному фонду Malina VC. Присутствие фонда в капитале «Даркстора у дома» увеличилось с 5,3% до 7,4%, рассказали RB.RU участники сделки.",3,1
инвестиции в стартапы 2024,1,"8 новых стартап-хабов из Европы, которые привлекли финансирование в 2024 году","Поддержка стартапов на стадиях от pre-seed до B. Акселераторы, фонды фондов и инкубаторы. Кто инвестирует в стартапы в 2024 году — читайте в материале RB.ru.",3,1
инвестиции в стартапы 2024,2,"Где стартапу искать деньги в 2024 году: 8 мер поддержки и более 20 программ, о которых вы могли не слышать | RB.RU","Стартап нуждается в деньгах, как в воздухе. Искать и вкладывать средства в проект можно по-разному: подключить личные сбережения, взять кредит, подать заявку на грант или обратиться к акселератору.
Где стартапу искать финансирование рассказал Кир Витковский, основатель и архитектор алгоритмов онлайн-сервиса «Метранпаж». Участник RB Choice и 100 перспективных российских стартапов, привлекший в 2023 году 10 млн рублей в раунде краудинвестинга.",3,1
инвестиции в стартапы 2024,3,Как получить гражданство Турции за инвестиции в 2024 году,Гражданство Турции можно получить за покупку недвижимости от $400 тысяч. Объект можно сдавать в аренду и получать пассивный доход.,1,0
инвестиции в стартапы 2024,4,Как привлечь иностранные инвестиции в IT-стартап в турбулентное время | RB.RU,"Согласно прогнозам Международного Валютного Фонда (IMF), глобальный ВВП в 2023 году ожидается на уровне 3% — ниже, чем в предыдущие годы. Во времена, когда ведущие экономики мира замедляют свое развитие, IT-стартапы интересуют инвесторов и венчурных фондов. Вице-президент по продукту платформы для анализа данных маркетинга и продаж Improvado Роман Виноградов рассказал, как привлечь иностранные инвестиции в IT-стартап.",3,1
