Запрос,Ранг,Название документа,Описание,Релевантность (1-3),Релевантность (0/1)
инвестиции в стартапы 2024,5,"Стартап хочет привлечь инвестиции — как оформить это документально, чтобы остаться в выигрыше | RB.RU","В современной российской практике используются два основных инструмента привлечения венчурных инвестиций. На этот выбор влияют цели стартапа: какую долю фаундеры хотят ему дать и насколько тщательная процедура проверки им нужна.
О шести аспектах сделочной документации и тонкостях оформления бумаг рассказали Михаил Крим, юрист Lex Borealis, и Михаил Мурадов, партнер компании. Их стартап Doczilla участвовал в акселераторах «Сбер500», «Крок» и MTS StartUp Hub.",3,1
инвестиции в стартапы 2024,6,Основательница MedTech-стартапа Checkme продала бизнес страховой компании «Капитал Life» | RB.RU,Страховая компания «Капитал Life» приобрела 100% MedTech-стартапа Checkme. Сделка состоялась 15 июля. Сумма сделки не раскрывается. Об этом RB.RU сообщили в холдинге. Для основательницы проекта Анастасии Файзуленовой это не первый экзит.,2,1
инвестиции в стартапы 2024,7,Wellbeing-стартап deep mind привлек первые инвестиции в размере $200 тысяч | RB.RU,"Проект deep mind с российскими корнями, который создает образовательные программы, решающие в компаниях проблемы стресса и выгорания сотрудников, привлек первые инвестиции в размере $200 тысяч от группы частных инвесторов.
Эксперты оценивают рынок wellbeing в России в 1 млрд рублей, называя его перспективным. Они также отмечают, что подобные программы востребованы в основном в крупных компаниях.",3,1
инвестиции в стартапы 2024,8,"Как продать свой стартап инвестору: 5 правил питча и 10 ниш, где сейчас в России деньги | RB.RU","У инвестора нет времени на сказки — только на факты. Судьбу любого питча определяют пять простых вопросов. Но даже идеальный ответ не спасёт, если стартап копает не туда. Инвестиционный директор и член совета управляющих фонда 3 STREAMS, номинант Forbes «30 до 30» Илья Курзанов даёт те самые пять вопросов — и 10 ниш, которые сегодня реально интересны для инвестиций: от агро и Арктики до демографии и кибербеза.",3,1
инвестиции в стартапы 2024,9,Как стартапу привлечь венчурные инвестиции | RB.RU,"Когда предприниматели Илья Павленков и Александр Воронцов основали стартап Jetlex, они смогли с первой попытки привлечь венчурные инвестиции, включая средства от Фонда развития интернет-инициатив. По их словам, это дало компании важный старт и стало не случайностью, а результатом тщательной подготовки. Как привлечь венчурные инвестиции, рассказал Илья Павленков, сооснователь стартапа Jetlex.",3,1
инвестиции в стартапы 2024,10,Как стартапу получить деньги: 10 вариантов финансирования,"Узнайте, как стартапу получить деньги с помощью 10 различных вариантов финансирования. Полезные советы и стратегии для привлечения инвестиций и успешного запуска проекта — читайте в статье на RB.ru.",3,1
инвестиции в стартапы 2024,11,Как скорость и венчурные деньги убивают стартапы? | RB.RU,"Альфред Лао, предприниматель и ментор, поделился своим мнением о роли скорости в развитии стартапа и дал рекомендации, что делать, чтобы попытки быть быстрее и венчурные деньги не убили проект. Материал ориентирован на фаундеров, развивающих бизнес на глобальных рынках, и основан на его наблюдениях за рынком и работе со стартапами, получившими венчурное финансирование.",2,1
инвестиции в стартапы 2024,12,К июню 2024 года инвестиции в туризм выросли на 65% — до 377 млрд рублей | RB.RU,"Инвестиции в российскую туристическую отрасль за первое полугодие 2024 года увеличились на 65% год к году, до 377 млрд рублей, сообщил представитель Минэкономразвития «Ведомостям».",1,0
инвестиции в стартапы 2024,13,Руководитель юридического департамента «Капитал Life» возглавила клинику на базе medtech-стартапа Checkme | RB.RU,"Руководитель юридического департамента страховой компании «Капитал Life» Светлана Шмигельская назначена гендиректором юрлица medtech-стартапа Checkme — ООО «Кэрифай». Изменения вступили в силу 25 июля 2024 года. Это следует из данных ЕГРЮЛ, на которые обратил внимание RB.RU.",1,0
инвестиции в стартапы 2024,14,Из «единорогов» в «зомби»: почему у стартапов заканчиваются деньги | RB.RU,"В ноябре сеть коворкингов WeWork, которая привлекла более $11 млрд, объявила о банкротстве. То же самое произошло с разработчиком ПО для грузоперевозок Convoy, чей объем финансирования составлял $900 млн.
В течение последних двух лет многие некогда многообещающие компании сокращали расходы, и сейчас у них заканчиваются деньги. Теперь инвесторы решают, кого спасти, и призывают других закрыться или продать активы.
Подробности — в пересказе материала New York Times.",2,1
инвестиции в стартапы 2024,15,Как стартапу привлечь деньги: 6 советов от инвестора | RB.RU,"Ежегодно инвесторы видят сотни стартапов. При выборе сделки они руководствуются определенными критериями, которые просты и понятны для них, но не для основателей. Партнер Prime Movers Lab Брэд Пруэнте перечислил шесть таких аспектов.",3,1
инвестиции в стартапы 2024,16,Бизнес на свои деньги: что необходимо учесть на старте? | RB.RU,"Когда и почему выгоднее делать бизнес на свои деньги, а когда имеет смысл обратиться к возможностям заемного капитала — этот вопрос волнует многих предпринимателей. За 10 с лишним лет Аркадий Хохлов, сооснователь AVO.Business, и его партнеры, Олег Герасимов и Виталий Кириллов, вывели на рынок 11 проектов в самых разных сферах — коттеджные поселки, финансовые сервисы, производство антисептиков, агрегатор лофтов в аренду и собственная IT-компания. И все бизнесы они запускали на личные деньги, не привлекая заемных средств.",1,0
инвестиции в стартапы 2024,17,IT-стартап GTLogistics закрыл раунд на 10 млн рублей | RB.RU,"Российский стартап GTLogistics, который автоматизирует складскую и транспортную логистику, привлек 10 млн частных венчурных инвестиций при оценке pre-money 350 млн рублей, рассказали RB.RU в компании.",3,1
инвестиции в стартапы 2024,18,Инвестиции в ИИ в 2024 году побили новый рекорд — 885 сделок на $56 млрд | RB.RU,"В ушедшем 2024 году инвестиции в генеративный искусственный интеллект, который включает в себя ряд приложений, инструментов и сервисов на базе ИИ для создания текста, изображений, видео, речи, музыки и многого другого, достигли новых высот. Компании в этой сфере по всему миру привлекли $56 млрд от венчурных инвесторов в рамках 885 сделок.",3,1
инвестиции в стартапы 2024,19,Финансирование тревел-стартапов в 2023 году: тренды и крупнейшие раунды | RB.RU,"На протяжении прошлого года фаундеры и инвесторы заявляли о сокращении объемов инвестиций, но компании в сфере туризма все же привлекли не менее $3,7 млрд. В материале — обзор крупнейших раундов и трендов в финансировании тревел-стартапов по версии Skift.",1,0
инвестиции в стартапы 2024,20,«Попробуйте пробежать марафон»: как стартапу привлекать инвестиции в акционерный капитал в 2022 году | RB.RU,"В 2022 году стартап Must планирует привлечь инвестиции в 100 млн руб. в акционерный капитал. Он разместил свое предложение на Rounds (бывш. «Стартрек»). Сейчас идет четвертый раунд финансирования проекта. 
Антон Редько, основатель платформы, рассказывает, как привлекать инвестиции в финтех-стартап и с чем может столкнуться фаундер в процессе размещения компании на инвестиционной платформе.",1,0
слияние компаний 2024,1,Количество сделок на мировом рынке слияний и поглощений в 2024 году упало на 15% | RB.RU,Количество сделок на мировом рынке M&A (слияний и поглощений) в период с января по август 2024 года (в сравнении с аналогичным периодом 2023 года) упало на 15%. Об этом говорится в исследовании GlobalData.,3,1
слияние компаний 2024,2,ВТБ завершил поглощение банка «Открытие» | RB.RU,"ВТБ завершил перевод отделений банка «Открытие» под свой бренд. Всего в состав кредитной организации вошли 245 отделений в 60 регионах России, говорится в пресс-релизе на сайте ВТБ. «Открытие» с 1 января прекратил свою деятельность, следует из данных ЕГРЮЛ.",3,1
слияние компаний 2024,3,Прибыль объединенной компании Wildberries и Russ превысила 100 млрд рублей в 2024 году | RB.RU,"Объединенная компания Wildberries и Russ — «РВБ» — отчиталась о финансовых итогах 2024 года. Чистая прибыль составила 104 млрд рублей, оборот — 4,1 трлн рублей (включая доходы от услуг рекламы и финансового консультирования, помимо электронной торговли).",3,1
слияние компаний 2024,4,Акционеры одобрили объединение «Росбанка» и «Т-Банка» | RB.RU,"Акционеры «Росбанка» одобрили его присоединение к «Т-Банку». Аналогичное решение приняли акционеры «Т-Банка». Общий капитал объединенной кредитной организации превысит 500 млрд рублей, сообщил председателя правления «Росбанка» Николай Сидоров.",3,1
слияние компаний 2024,5,ВТБ получил одобрение ФАС на слияние с «Почта Банком» | RB.RU,"ВТБ получил одобрение ФАС на слияние с «Почта Банком». Объединение организаций произойдет в 2026 году. Отделения «Почта Банка» продолжат работать, но уже под брендом ВТБ.",2,1
выход на IPO,1,«Автодом» перенес выход на IPO на 2025 год | RB.RU,"Группа компаний «Автодом» перенесла на 2025 год выход на IPO на Московской бирже. Дилер намерен привлечь порядка 30 млрд рублей максимум за 30% капитала, узнали «Ведомости».",3,1
выход на IPO,2,ФРИИ спрогнозировал выход более 400 IT-компаний на IPO в ближайшие 2–3 года | RB.RU,"409 российских IT-компаний могут стать кандидатами на проведение IPO в ближайшие 2–3 года. К такому выводу пришли аналитики Фонда развития интернет-инициатив (ФРИИ), подготовившие исследование «Возможности IPO и PRE-IPO в России», с которым ознакомился RB.RU.",3,1
выход на IPO,3,Мосбиржа и ЦБ будут стимулировать эмитентов выходить на IPO с помощью pre-IPO фондов | RB.RU,"Московская биржа предложила ЦБ РФ стимулировать эмитентов выходить на IPO путем продления нацпроекта «Малое и средней предпринимательство» до 2030 года и расширения его действия на МСП с выручкой до 10 млрд рублей. Помимо этого Мосбиржа предлагает создать «линейку pre-IPO фондов» для обеспечения pre-IPO финансирования потенциальных эмитентов — компаний, «обладающих инвестиционным потенциалом».",3,1
выход на IPO,4,«Окна ликвидности» на фондовом рынке: когда компаниям лучше выходить на IPO | RB.RU,"В контексте ренессанса на рынке IPO аналитики вновь заговорили об «окнах ликвидности» — наиболее благоприятных периодах для выхода на публичный рынок, когда финансовая система имеет наибольший объем свободного капитала. Но есть ли они на самом деле? 
Наблюдениями поделился основатель инвестиционной компании «Юнисервис Капитал» Алексей Антипин.",3,1
выход на IPO,5,Минэк создаст биржу для pre-IPO малых технологических компаний | RB.RU,"Минэкономразвития вместе с экспертным сообществом планирует запустить биржу для pre-IPO малых технологических компаний, сообщает РБК со ссылкой на представителя министерства. Таким образом технологические стартапы смогут быстрее привлечь инвестиции и выйти на публичный рынок, считают в ведомстве.",3,1
выход на IPO,6,Президент РФ разрешил IPO государственной компании «Дом.РФ» | RB.RU,Президент РФ Владимир Путин разрешил провести IPO государственной компании АО «Дом.РФ». Указ президента размещен на портале публикации правовых актов. Государство сохранит 50% плюс 1 акцию компании.,3,1
выход на IPO,7,Мосбиржа запустила сервис диагностики компаний перед IPO | RB.RU,"Московская биржа представила первый в России цифровой сервис для самодиагностики готовности компаний к IPO. Он позволяет бизнесу оценить уровень зрелости перед выходом на публичный рынок и получить рекомендации по дальнейшим шагам. Эксперты называют инициативу полезным ориентиром, но отмечают, что алгоритмы не заменят экспертную оценку и полноценную подготовку к размещению.",3,1
выход на IPO,8,«СПБ Биржа» сосредоточится на IPO попавших под санкции российских компаний | RB.RU,"Попавшая под санкции «СПБ Биржа» сосредоточится на IPO российских компаний, в отношении которых также действуют западные ограничения, рассказал гендиректор торговой площадки Евгений Сердюков.",3,1
выход на IPO,9,«Совкомбанк» объявил об IPO | RB.RU,"«Совкомбанк» проведет первичное размещение акций в период с 1 по 14 декабря. Ценовой диапазон бумаг составит 10,5–11,5 рублей. Об этом RB.RU сообщили в пресс-службе банка.",3,1
выход на IPO,10,Банк России рекомендовал компаниям раскрывать больше информации при IPO | RB.RU,"Банк России рекомендовал компаниям раскрывать больше информации при IPO. Например, о точном распределении акций при размещении и акционерах, которые обязались на время не продавать ценные бумаги после IPO. Выполнение рекомендаций повысит доверие к рынку, считают в ЦБ.",3,1
выход на IPO,11,IT-компании столкнулись с юридическими проблемами при подготовке к IPO | RB.RU,"Увеличение интереса российских IT-компаний к проведению IPO привело к ряду юридических трудностей, связанных с изменением формы собственности и сохранением данных в профильных реестрах Минцифры. Об этом «Коммерсанту» рассказали представители юрфирм и источники на IT-рынке.",3,1
выход на IPO,12,"Капитализация «Совкомбанка» в ходе IPO составит 230,5 млрд рублей | RB.RU","«Совкомбанк» объявил о начале торгов акциями на Московской бирже. В ходе IPO организация разместила 1 млрд акций, а общий размер IPO составил 11,5 млрд рублей. Об этом сообщила пресс-служба «Совкомбанка».",3,1
выход на IPO,13,"«Эволюционируй, если сможешь»: как Pre-IPO спасает технологический бизнес в России | RB.RU","Рынок pre-IPO в России — явление новое, но уже доказавшее свою эффективность в поддержке технологического бизнеса. О том, как зародился этот механизм и как он работает, рассказал директор по маркетингу сервиса аналитики и продвижения «Анабар» Максим Самойленко.",3,1
выход на IPO,14,Стартап «Анабар» экс-сотрудников «Циана» создал холдинговую структуру для выхода на IPO | RB.RU,"Система управления продажами на маркетплейсах «Анабар», которую основали выходцы из «Циана», учредила АО «Анабар» — эта структура нужна компании, чтобы провести процедуру Pre-IPO. В дальнейшем владельцы рассматривают продажу компании стратегическому инвестору или выход на IPO.",3,1
выход на IPO,15,Московская биржа начала рассчитывать индекс IPO | RB.RU,Московская биржа начала рассчитывать и публиковать новый индикатор — «Индекс МосБиржи IPO». Об этом говорится в сообщении торговой площадки.,2,1
выход на IPO,16,Новичок на бирже: может ли частный инвестор заработать на IPO-акциях | RB.RU,"На российском фондовом рынке становится все больше частных инвесторов. Они охотно скупают акции крупных компаний, но часто игнорируют перспективные IPO. Как выбрать новую компанию для инвестиций и на что обратить внимание в момент проведения IPO, рассказала Марианна Мовсесян, генеральный директор инвестиционной компании New Venture Brokerage.",2,1
